"I took a ceramics class in high school. I spent weeks working on a massive coil pot. One day when I was nearing the end of my project, I decided I didn't need to wrap the pot in plastic anymore because I would be finished with it soon enough that it drying out wasn't a problem. As I was leaving the classroom that day, however, my ceramics teacher noticed my pot wasn't wrapped and told me that I really needed to wrap it. She said it would dry out more than I expected and possibly even crack. I told her that it was fine and I knew what I was doing, despite the fact that this was the first ceramics class I had ever taken. The next day I walked in to find my incomplete pot completely dry and cracked down one side, completely unworkable and thus unfinishable. I learned that professors, instructors, and other people placed in positions of direction or management are there because 1) I need help and 2) they are capable of giving it. I also learned, more generally, that I should be less stubborn. :)"
"When I was planning a charity event at my high school, as lead organiser, I thought I had to plan everything on my own and that most of the tasks would fall on me but I could handle it. Looking back, it seemed crazy to think that I could book event space, handle ticket sales, decoration and coordination of a band and photographer all on my own. I learned that it's ok to rely on other people and not everything has to fall on my shoulders. "
"When I was working as a Product Management Intern at a tech startup last summer, I was in charge of working on User Interface design for our company's Android platform. By then, I had extensive experience in using Android devices from personal usage, so I believed I understood everything about it, but it turned out that I was completely wrong. I didn't necessarily understand the complicated technical details behind the platform and hence learned to be more humble and learn from other people in my work environment. "
"This past summer I worked at a hedge fund. Among other things, I was responsible for typing up transcripts for our calls with investor relations. The first time I typed up a call, the analyst in charge emailed me back saying my work was atrocious. I had typed up the call full of commas, in a short hand style that I use for class notes. I wrongly assumed that he would also understand this type of transcription. I learned then the primal importance of knowing your audience - the purpose of typing up the call was for the analyst, not myself. "
I assumed that a Christian friend of mine would be judgmental or end our friendship because of my sexuality. I was wrong. I learned not to assume without concrete information.
"I was designing an iOS application that has similar characteristics to the Instagram design. I proposed to my teammates that we should aim for a design that is simple and clean-cut. More or less, my leaning towards minimalism led to a lackluster design. When my teammates and I presented the application, we received feedback that the design was not exciting. From this experience, I learned that clean design does not necessarily mean minimalism, and user testing is invaluable to the process of design.   "
"During my PM internship last summer, I thought I had a solid understanding of our customer base and what needed to be communicated to our UX designers to meet those needs. Feedback from my manager said otherwise, and I had to pivot. However, along the way, I gained valuable insight into the aspects that I had neglected to inspect before proposing the spec."
"At my internship at the Skimm, I was working on implementing a new feature onto our mobile application SkimmAhead. My role was to flesh out the features from a product management stand point and design the implementation and functionality. However, after I completed the entire product roadmap and presented it to the entire company, I received feedback saying that to build a chat feature requires a lot more thought and implementation than I originally suggested. Though I had a misunderstanding about what the requirements were and put effort into a project without understanding the scope of it, I learne when working on a project/feature that multiple teams need to be involved in, one needs to collaborate with the teams when coming up with the specs for the project. For example, if I had worked with the engineering team more thoroughly when planning out the features then alot of the features I suggested could have been simplified and thought out more to be made feasible to build. Collaboration in project and work environments is key to successful product building and execution"
"In the fall of 2015 my friends and I decided to enter a hackathon on campus called lionhack. We figured that it would be a good experience for some hands on projects even though we had only taken a few programming courses. We should have realized that this wasn't quite a typical hackathon from the start as it was hosted by the business school and seemed to be about 95% business students. We were handed out the instructions which consisted of a fairly general projection completion with a financial analysis side including a business model, profitability, marketing, and other financial issues associated with an idea/product. We saw these financial goals as periphery as we thought we could just develop an interesting app as that had been our experience at other hackathons. Throughout the 24 hours we developed a product called politckr which would improve upon finding less biased political views from college students and young people. The app was interesting, but it certainly lacked an extensive financial side--we had only spent about 2 hours working on that. As we walked into the judging room we all very quickly realized that the developing piece was truly the insignificant part, and financial analysis part the meat what the judges were looking for. The judges themselves were venture capitalists. Long story short, we got absolutely destroyed (I truly mean obliterated) for having a very lackluster business side to things, in fact, the audience was actually laughing at how pathetic our financial side was. Honestly, they were right, the competition we entered was clearly a venture capital competition hosted by the BUSINESS school. We had just glossed over that to focus on our supposed strengths. I learned that day on the true importance of orienting one's compass before just diving into the workflow. If one of us had stopped to look around and recognize that this fun and exciting project would in no way fit their criteria (which it clearly didn't) we would have been able to put up a much better showing. I am the kind of person who really likes to dive into to things, sometimes without enough thought. It saves a lot of time to truly orient yourself before starting a large undertaking. Now, whenever I start something large, such as my project over the summer, or even small such as a homework question, I very carefully outline my criteria and idea and make sure that they will not just match up now, but down the road as well. "
"A couple summers ago I was working at the Harvard Kennedy School with another intern.  It was basically just all summer.  We spent a lot of time talking about tech and business, and for early on, I found myself being proven wrong on most things we argued about. I had a lot of opinions that were more or less read and taken in stride.  He made me really start making myself test if I really understood something, or if I just had a good sentence or two to say about it without any depth.  So, lessons learned: 1. routinely trying to explain things to myself or other people to poke wholes in what I know 2. starting from first principles as often as I can"
"I'm am currently working with a team on a Hacking 4 Defense project (COMS 4995). We are creating a tool and the whole process is trial and error - after a few rounds of interviews we found out the the first MVP we were building wasn't directly answering the problem. After further investigation we realized that the best way to approach the problem was to focus on many different types of users and not only the higher ranked users, in order to create the perfect solution that works for all ranks. "
"When I was in high school, I applied to Columbia as a music major, convinced that I would either major in music or English. All my life, my parents had tried to steer me into math, physics, or computer science, but to their detriment, all that did was to make me avoid those subjects like the plague.

It wasn't that I didn't inherently like science and engineering; I was surrounded by kids who I thought was much smarter and talented at engineering than I. I thought I had no inherent talent at engineering, would never survive classes, and wanted to study areas where I thought I was talented. 

In fact, I probably would've majored in English or Music had it not been for one event; I attended a computer science club meeting at my school on a whim. No, a love for computer science did not suddenly blossom there -- instead, I was met by a group of rather unfriendly male faces who scoffed at me, a girl with no knowledge of CS intruding upon their territory.

I came away from the meeting feeling a bit sad and extremely indignant. At that moment, out of indignation, I decided to create my own club; the Technovation Club, where I gathered female students who had never coded in their lives. The Technovation Club would, I hoped, be a space that was encouraging and inclusive to its members who felt intimidated by computer science like I was. 

Although we members of the Technovation Club never won any awards, we were proud that we had tried our best to learn. As I took introductory computer science classes at first, my local university, then at Columbia, I started to realize: people only became skilled at something because they spent a lot of time and energy learning the skill. Because I spent a lot of time reading and writing in my childhood, of course I was a fast reader and a good writer!

The more time I spent learning the fundamentals of programming, the better I inevitably got. Although I still find CS classes at Columbia difficult, and frankly, intimidating, I now realize that time and effort will lead someone farther than what we call ""talent"". I still love the arts and hope to integrate them with my technical skills. Throughout college, I've continued to create music, and this hobby, along with figuring what I like in Computer Science, made me realize I want to explore creating digital media content for users. "
"The first answer jumps in my head is debugging. No one likes bugs but as we go through the debugging process, we will have a deep understanding on what mistakes we made so that we could avoid that mistake next time. Generally, we are making mistakes every day and I am glad that I always learn something by fixing it."
Once I thought doing well in one specific field will help me get a job but ended up figuring out that there's way more expectations from the employer side.  I used to be focusing only on backend development but now I am eager to explore more about front end development tools.
"I've always been one to multitask and to immerse myself in an array of activities. Coming to college as a freshman, I did the same thing with challenging classes, internships and clubs. However, I soon realised that I was trying to do too many things and no matter how organised I was, I couldn't handle being a jack of all trades. I learnt that I had to choose and prioritise in order to give each task sufficient time and dedication. Now, I am able to dedicate myself fully to each class I take or each activity I participate in. "
"Sometimes I don't quite understand or misunderstand the assignment, and start working on it. After I try something I think relevant, I became familiar with the environment and the project and then I get on the right track. I think the important thing when unsure about something is to talk to somebody who's also working on it. It is okay to start trying some small things but working on something big that turns out not useful is often time consuming. "
"Whilst taking operating systems my junior year, I worked in a group of three to complete all of the group homework. During these homeworks, there were several times when I either encountered situations where I was wrong because of an incorrect assumption I had made, or I had misunderstood a concept, or because there was a failure in communication within my group. What I learned from these experiences, was to be more open minded and to speak up when I have questions or concerns. By doing so, by the final homework my team had much better coordination and also more success through discussion. I am an outgoing person with my friends and those that I know, but in new situations I can be a little bit shy. This experience challenged me to speak up sooner, and I am looking forward to also challenging myself to speak up and participate in class. I like to participate in discussions and both share my own and listen to opinions of others, and it was this experience that taught me just how important that is. I especially feel for UI design just how important that would be, because it is not just the hidden underlying software, but what users have to interact with."
"Life is full of mistakes. When I was new to application development, I always made things too complicated at the first stage and then spent a lot of time debugging. What I've learnt from it is that we should first make up a frame and then add features little by little, and at the meantime we should keep testing the new features."
"During my service in the Israel Defence Forces, I was part of the R&D team for a highly classified software. At the time of combat, our software was the main communication tool between commanders in the fields and generals in the command posts. The consequences of malfunction in our software meant loss of soldiers lives in the field. It was the days leading to a very important operation by the one of the IDF commando units outside Israel borders, and I was in charge of the software new feature testing. After starting to work I was lucky to find out in time that I was wrong about my estimation of schedule of testing. I communicate my problem to my commander and together we worked out a new schedule and plan of testing so we can successfully deliver the best quality product to the field and avoid malfunction in real time. As a result our software was successfully deployed in the field and the operation went smoothly with no critical problems or downtime. From this experience I learned that if one finds a problem in the process or that their approach is wrong, it is never too late to stop and reassess. I learned that failure is multidimensional, and a process towards success."
"During a summer internship, I was working on a project which introduced me to new technologies and concepts I had yet to encounter. Out of a great will to prove myself, I took on more tasks than I could handle and attempted to compensate for my lack of knowledge by learning multiple technologies at once. As a result, I couldn't meet my first deadline. I realized that my biggest mistake was that I did not report on open issues to my managers soon enough and that I should have admitted I was struggling to keep up with all the new tools I was using. 
Further into the project, I learned to manage my tasks more accurately and report on issues I found hard to handle alone. I understood that by reporting to my managers on time, they could better understand my progress and assign other colleagues to help me out with certain tasks."
"I have directed two productions for theater and the first one was Jumpers by Tom Stoppard in spring of 2016. The experience of putting on this show was filled with ways in which I was wrong and had to learn how to be better. Though, one of the clearest ways was in the what I imagined would make a good show. I thought that the singular thing which I needed was to have a big idea at the center of my project. I built on this concept of modern politics being performance and spectacle without substance, researched heavily and thought that supporting that would be the focus of my show. But there was one thing I forgot about in all this: the people! I rather quickly realized that I hadn't considered what people on the wanted to work on or would even understand. Even more importantly, how I would get them on board for my big vision? When rehearsals and meetings with designers started, I took several steps back and found out what they took from the text, what interested them and what their talents were. I began to let the style of the show build more naturally through these conversations and found everyone understood their parts and took ownership rather immediately. Through this all I learned a lot about creative leadership and how much of it centers around giving the talented group I have brought together the space to be amazing."
"I work as a full stack developer for a startup. Because of the small size of team, I need to do the user interface design as well. But at first, I knew nothing about that, so just trying to find some great UI on Pinterest and other websites. Latter, I find that I am wrong. Because in most case, I need to analyze what should my page display and then try to arrange the components on the page. I am very eager to take this UI course, because I think being a full stack developer you not only need to know how to code, but also need to know how to design!!"
"Two semesters ago, I was in a Computer Science class that had a final group project where we were to be in groups of four. After evenly splitting up the workload and starting to work on the project, we were, for some reason, not able to upload our project to GitHub in the way we usually did. We thought that we would be able to handle this by just keeping the main project on my laptop and having the other team members write pieces of code on their own laptops and send them to me so that I could integrate those code fragments into our project. The integrations ended up being not as straightforward as we had originally thought and, consequently, I ended up having to do the majority of the project myself, since it was on my laptop and there was no good way to split up the work so that team members could work on the project in their own time. Looking back, I would have invested more time in learning how to upload a project of our type onto GitHub, as it would have made working together on the project later much easier. I learned from this experience that it is not only vital for team members to split up work evenly, but it is also important to establish early on exactly how this splitting up of work can be made as seamless as possible. "
"I used to think that the content is the most important part of work. However, when I did not receive good response in my presentation regardless I did lots of work, I noticed that skills in user interface design is really important."
"I used to be opposed to using Linux operating systems on my undergraduate institution's honors lounge computers because they seemed more difficult to work with, but once I began using Linux more, I really enjoyed the control I had. I was just scared of change. I have learned to be more suspicious when I feel too good (that is, elitist) for something unfamiliar."
"During one of my journalism classes I constantly felt as though my story idea was not good enough, as the professor picked it apart. However, I learnt that I had all the information in my story it's just the way I was presenting it that was wrong. He taught me how to restructure it. "
"Last summer, I worked as a product manager at a fast-growing fintech startup in San Francisco. The company is well-known for its digital mortgage platform, which allows some of the top banks in the U.S. provide a frictionless mortgage experience to their customers. During my three month internship, my job was to launch the company’s first new product: home equity loans. I was determined to have the product live in production with at least one customer before the summer was over. Moreover, I wanted it out as soon as possible. I worked like a madwoman, taking on tasks outside of my purview, to get things ready. I had incorrectly thought that the sooner, the better. However, when the product was finally ready to launch with our first customer, they weren't ready for it. I had blindly been pushing the team to get the product out without making sure that our pilot customer was on the same schedule. Consequently, I had to channel all of my energy into helping the customer get up to speed instead of monitoring the launch of the product. This taught me several things: 1) A product is nothing without the customer. You can slave away creating something wonderful, but it's not complete until it is in the customer's hands. 2) Think carefully about what you are optimizing for. Clearly, I was optimizing for speed, but for no good reason other than my own competitiveness. Instead, I should have been optimizing for usability. These are lessons I will take with me into my future product development efforts."
"When I first came into web application development, I though the most efficient way to be the most productive developer is to learn the newest tech stacks which are the best solutions for now. But then after I explored plenty of frameworks and concepts, I realized I made two false assumptions at once. The newest solutions might not be the best solutions in terms of completion level (solve one problem effectively but not for the others, especially corner cases), community maturity (the number of active developers), etc. And my colleagues may not want to invest their time in new stuffs so I can only be more productive on my own using the new solutions but not in a team."
"I was hired by a small medical office to develop a technical solution to solve a problem they were having with patients. Patients were forgetting their appointments and not refilling their medicine. Automatically, I thought “you need a mobile app.” However, even after deployment of the app, the numbers were not increasing. Patients were still missing their appointments and there were not many app downloads. After doing a careful study and analyzing more data about the patients’ technical adoption behavior, I realized that a mobile application was not the best solution. Instead, a simple Twilio SMS chatbot would suffice. Most patients either did not have a smart phone, used a government issued flip phone, or did not know how to use the app properly. I learned that sometimes the simplest can sometimes beat the most innovative. While it is good to push society sometimes out of their comfort zone to try new technology, I now strive to build solutions that are better suited for the end user. "
"I started wanting to do Computer Engineering, then changed to Computer Science, I learnt that I had to cut my losses and move on into a field that interested me. It is better to change your mind, change course and keep on, than going the wrong way and never stopping to see where you are going."
"During a summer internship at a startup, I had to give a presentation on the functionality of an application that my company was going to use for their product. Unfortunately, I didn't do my research properly, and falsely reported on how to use one of the commands. Specifically, the information that I gave was for a version of the program that the company didn't use. When I discovered this a couple days later, I sent out a Slack message to everyone apologizing for my mistake and explained the correct way that it worked. I also updated the summary that I compiled and sent out during the presentation. From this experience, I learned to always double-check and test everything in computer science, and to not blindly rely on documentation that might be out of date. In addition, I learned that team communication was vital as soon as you realize that something is wrong, so that everyone is up to date with recent changes and can adapt to the situation. "
"When I was software engineer intern @ Cisco, I once participated in a cool project as a full-stack engineer (responsible for both front-end and back-end), we    
 designed and implemented great features but received need-to-improve feedback about user interface design / user experience design, which made me frustrated. That made me awared that the importance of UI/UX and started to learn how to make better user interface."
"I forget exactly what the argument was about, but the end result was that I learned that just because I am right doesn't mean someone else is wrong. I also realized that this applies to CS - there is no one right way to do things so it's best to keep an open mind. "
