"I interned at a company whose app included a panorama-stitching mode. At lunch one day, I asked why the panoramas contained so many visual artifacts, pointing out other algorithms without this problem. As it turned out, they chose the current algorithm because they valued its ability to give users fast results. This experience taught me to be curious before providing criticism."
"I had lost some focus as a student entering fall semester 2016, and though my academic performance that term was good, I didn't feel like I was making a hard and honest effort. I decided to take the spring term off and spent my time augmenting my art portfolio, taking a web development workshop, working at a restaurant, visiting family, and traveling. I returned to school last fall feeling revitalized, proud of my decision to take time off and of my schoolwork by the semester's end. "
"During my previous semester in the Advanced Software Engineering course, my team decided to develop a web application to rent parking spots (like Airbnb for parking spots). We invested most of our effort in developing key functionalities like displaying nearby parking spots on the google map and enabling the user to communicate with the owner of the parking spot and neglected the User Interface. While demoing to the TA, his feedback was that as an end user, he loved the features provided but wasn't impressed by our user interface. So before our final presentation, I changed the complete look and feel of our web application. During our final presentation to JP Morgan, the employees were particularly happy with our UI and one of them even mentioned that we stood out from the rest of the projects because of our UI.

This incident taught me how having a good UI helps build a terrific first impression which goes a long way in the end user's satisfaction in a product."
"One time I was wrong was during my internship at the media research company Nielsen. One of our research projects was aimed at figuring out how media immersion affected how well users remembered content (for instance, whether viewing content on a very large screen or at a closer distance would make it more memorable). My first proposal was to send participants to locations with displays of varying sizes, including theaters, and at different viewing distances. However, I was wrong that this was the best approach, as it would have been cumbersome and inefficient. Instead, we decided to create a virtual reality scene in which we could insert a virtual 2D “screen” displaying our content, which could be scaled and positioned in different ways. This could be viewable through a VR headset in one location, as opposed to sending participants to a wide range of places. From this experience, I learned that thinking of creative ways of using the right digital tools allows for much more reflexible solutions to many problems."
"I worked on an android studio project last year. Our topic was ""scientific calculator"" which could store and save special formula for Physics student. At first, we tried to make everything ""scientific"" -- super accurate. But it turns out no one would like to use it, because of the bad user-friendly design. So we started over on that part, and found our way out. 
I learnt from it that we first need to know who are our targets and their needs."
"Rather than talking about a time I was wrong about something, I would like to talk about a time I did something wrong. It was when I was the publicity chair of a dance team on campus in my sophomore year. My main responsibilities were to coordinate photographer and videographer for our dance performances. For our very first performance of the semester, there was some miscommunication between me, the president and the videographer, which led to us not having a recorded video of the performance. I realized that it was partially my fault, since I was the one who's responsible for it, but I did not make sure that we had a videographer for that show. After that, I learned to be vigilant about coordinating with people; I would managed to coordinate a photographer and a videographer a week in advance of a performance, and double check with the rest of the executive board that we certainly have them."
I met a girl last year in a class. I was very fond of her. I tried all opportunities to talk to her and put a beautiful godiva chocolate box in front of her door on Valentines day. I thought she would like me and became my girlfriend because she was very nice to me too. But I was wrong. She would rather finish homework well ahead of time rather than go to dinner with me. Well. I understood. I learned that I have no chance before a girl who prioritizes academics over all other things in life. 
"I was frustrated when I did my thesis research. I could not come up with innovative solutions. However, I finally developed my own algorithm by carefully observing collected data. The lesson I learnt is never to neglect details. "
"The process of learning React and Redux this past summer while designing a user interface for my internship involved me making many design mistakes and programming errors. React has a steep learning curve and the user interface I was designing was a complicated one. However, in making mistakes and receiving constant feedback from my boss, I was able to refine my design and learn how to write scalable and maintainable react code, resulting in a great product and experience in the end. "
"In the spring of 2016, I was taking Data Structures at Columbia as a non-degree student. At the time, I was thinking of pursuing a master's in computer science, but, having not studied CS as an undergrad, I needed to complete some undergraduate coursework first. I distinctly remember walking out of the Data Structures midterm feeling as though I had done poorly, despite having studied extensively for the exam. I tried to catch a movie after the test, but couldn't concentrate; instead, I ruminated on my ostensible failure, and considered abandoning my plans to pursue a master's. After all, if I couldn't do well at this level, what sense was there in pursing the subject at the graduate level? A week or so later, when the results of the test were published, I was surprised to see that I had done quite well on it -- well above average. What I learned from the ordeal was to not prematurely judge or assess situations; not only are supposedly catastrophic outcomes rarely so catastrophic, they can in fact be quite the opposite.   "
"I interned last semester at Microsoft and we had a hard deadline and the project didn't turn out like what I had hoped or imagined. My team wanted to ask for an extension, but I didn't want to ask for one since I wanted to live up to the expectation of my mentor. After long discussions, as the decision maker of my team, I decided to think for myself and weigh out the pros and cons. After a lot of thinking and consideration, I decided to ask for the extension and my mentor approved it. I got my team together and we worked on the project for many hours and it turned out to be just like I had hoped. We ended up placing first and everyone loved our project and it was successfully launched on the desired date. Overall, I learned that sometimes its best to take the risk and to hear out other people and take a decision without looking back. Taking risks and having things not go as planned isn't a bad thing after all. "
"When I was in High School, I was a rower at a local club. In my senior year, I was elected captain of the team and had to face new leadership challenges. At one point, I became aware of a fellow senior of mine showing up to practice while high on marijuana and drunk, and it became my responsibility to decide how to handle the situation. I had a few options which revolved around going straight to the coach or confronting the individual first and attempting to resolve the situation that way. I elected to follow the latter course of action and confronted him directly, but I was very untactful with how I went about it. Much of the conversation involved me accusing him of messing up and being a bad teammate, which only made him angrier and more inclined to lash out. There was nothing untruthful in what I said to him, and I believe it needed to be said, but I think things would have turned out better if I had asked him about the things going on in his life first and then working into what the team could do to help him, so that he could be better for himself and for us. In the end, I learned that every situation can be approached from multiple angles, and that one should strive to approach from the most positive angle they can."

"I grew up with strict parents that instilled in me the mindset that academic subjects were for the best and brightest, and because of this I had always assumed the arts were easier. I used to overlook graphic design, because I assumed that if I could get my websites up and running, I had the technical background that would enable me to easily format them to look nice. However, when I was organizing a hackathon my freshman year and I started trying to make logos and other marketing pieces for the event, I realized that I didn't even know where to start. Every lion I tried to draw, every picture layover or pretty title, looked incongruent with each other, and led to a rather haphazardly careless looking theme when put all together. My designer friend stepped in and reworked everything – teaching me skills like spacing/padding, alignment, theme continuity, etc. I learned that day how incredibly complex and creative design could be, with extreme out of box thinking and pattern matching, and I resolved from then on to try my best to learn. It's been two years, and I'm no expert, but I do think my powerpoints look a lot better than they did before!"
"A couple of semesters earlier, I overcommitted myself by taking on a full time courseload, 3 extracurricular board positions, and a part time job. I thought that I would be able to handle all of it well if I just learned to manage my time better. But, it turned out that even after my best time management skills, I was not performing my best in a lot of the activities mentioned above. The experience made me realize that regardless of how well I manage my time, I would still have a limited number of things that I could commit to and do well in. So, from the experience, I took the lesson to think about what I care about most deeply first and to prioritize based on that. So, for instance, I know that I care about both women in technology and reading. But, I care more about making a difference in the former so I decided to stay on the board of CU Women in Computer Science and not pursue a board position at Barnard Bookworms, Barnard's reading club."
high school 
"Not long ago, I had an argument with my mom. She complained that I visited my grandparents (my father's parents) constantly while ignore her feelings and I had been unfair to her since she was the one that brought me up. I got angry and thought she was unreasonable. I stopped talking to her for a few days. I think it must break her heart. I felt really sorry, sad and struggled, but didn't know how to express the feelings or just being shy to say it. I thought through what she said and realized that I might ignore her feelings sometimes. I learned that I should care for her more and had a better way of dealing with argument other than not talking and breaking both our hearts."
"I strongly believe in the value of learning through the iterative process, which means I'm wrong quite often, but I usually try to take something away from it. One of the more significant experiences I've had of being wrong was in the final  of an important chess tournament where my haste and arrogance caused me to make a big blunder and lose the title. I believe the experience was very humbling, and recalling my mistake still hurts several years later– which makes me believe I have learned something from it."
"Last semester, I took the introduction to database course. As I have taken the basic database course during undergraduate study, I thought it would be easy and did not put much effort at the beginning. However, I found I was wrong when I was taking the midterm exam. I learned that any knowledge would possibly be forgotten if we have not touched it for a long time, and things would not be as easier as we thought in the early time. I was flustered at that time, but I adjusted myself to study harder and listened to the instruction carefully. Finally I went through all the difficulties and got an A in the final exam. I learned that it would never be late if you want to have a change."

"For my group's 4156 project I was convinced that using mysql for the backend would be easier since everyone in the group had at least some experience with sql and relational databases and mongodb seemed like a whole new learning curve to overcome.  We ended up implementing basic versions of both solutions in the earlier stages of the project and I was pretty hardheaded about keeping the mysql version and even had schemas planned out for the entire scope of the project at the time.  However, as the scope of the project stretched and shifted through the semester, it became clear that our requirements had changed and my groupmate's implementation of objects to store our project's data was much more flexible and was much simpler and more elegant to change when requirements shifted.  In the end, we ended up wasting a lot of hours completely rewriting and tweaking the mysql tables to try and make it work with our changing requirements while tweaking objects in mongodb took only a few minutes after we gave up on mysql.  I learned to be more open minded about new or unfamiliar tech and platforms and being more mindful about using the right tool for the right job and exploring options to be sure of that and to hear out my teammates more."
"There are many many things for me to speak about here but the instance that immediately comes to mind is my decision to invest in Bitcoin. I was pretty late to the game and didn't actually purchase Bitcoin until around a month ago when it was at 15k. Today and the last couple days it has seen pretty drastic downward drops. I was convinced that even though I was a little late there would still be a bunch of other people late to the fad who would also be looking to get in which would continue to bring up the price. At least at the moment it appears as if I am wrong. Hopefully it will resurge again but what I learned is a smarter way to approach volatile investing like this: while it is tempting for me to just sit and wait and hope that it goes up, I believe that I need to put precautionary methods in place to capitalize on the volatile nature of bitcoin. I need to come up with pre-set rules to determine when I will buy and sell instead of just ad-hocly hoping that I get lucky as I am doing now. Hopefully I will actually implement this my future investing strategies. "
"When I began interning as a data scientist at Facebook, I assumed that I had a good idea of which websites were most popular to facebook users. I later discovered that I was completely wrong—sites like nametests.com took the cake. I learned then and there that I am by no means the average user and that it's important to actually speak to the people you're building things for"
"I work as a manager at a tutoring center for elementary to high school (and even college freshmen) students. I know I'm not the perfect manager and during my time working there thus far, I have made mistakes. One instance involves a parent/customer who had made a request for their student/child (such as focusing on a particular topic/subject/homework assignment). However, the new instructor didn't fulfill that request for the student during the 2 hour lesson. In this case, I realized it was my fault for not emphasizing to all the instructors the importance of proper communication with parents/students. I also had not made sure to clarify this specifically to the newer instructor most likely because I was accustomed to assuming that all the instructors knew the routines/guidelines/policies of their job. Additionally, I should make sure that I myself know of any complaints/requests made by parents because they are paying in order for the students to show improved academic performance in school. I made sure to communicate with the parent properly to amend and resolve the situation. "
"I once went out with my friends on Valentine's Day because my significant other said it was ""fine"" for me to do so. Much regret. ""Fine"" doesn't actually mean ""fine""."
"As an engineer I used to undervalue the business component to developing a tech startup and overvalue the engineering and technical parts. 
About two years ago, a friend reached out to me with a new startup idea. As we were close friends who worked together in the past, I almost immediately jumped on board. Our philosophy was to build first and ask questions later – as the cliché goes, ""build it and they will come"". 

About a year later we launched a beta and invited our friends to join. Turns out we built something people liked but didn't love (except for maybe one user). In retrospect, we should have spent a lot more time on the ideation phase figuring out what features people would have been passionate about. We applied to accelerators for the past two years but had no traction whatsoever. We continued to work on the startup and kept it in closed beta – my friend was concerned if we shared it on HN prematurely people would critique some of the major coding flaws within the app. On the technical side, we also over engineered the server hosting configuration – we used AWS and convox instead of a simple heroku setup. This also incurred significant server costs which caused us to eventually shut down the project. 

This past summer my friend and I started another startup with two other folk called Epigrammar (epigrammar.com). My other friend has a background in education and was a full-time teacher for a bit. Earlier last year, he had an idea for a tool for latin teachers and pitched it to his coworkers and other teachers. After some feedback, he pivoted, and the modern version of Epigrammar was born – a tool for teachers and students to collaboratively annotate educational documents, and for the teachers to automatically generate tests and assessments from the annotations. He formed the team and applied to the Princeton Entrepreneurship Lab Summer Program – and got in! 

At that point, Techcrunch Disrupt New York was quickly approaching, and my friend and I decided to develop an alpha version for the hackathon. My friend planned on building the backend in Elixir, Phoenix and GraphQL, and I planned on developing the frontend in React, Semantic UI and Apollo. Turns out he was not as comfortable with the technologies as he thought, and half-way through the hackathon, we decided to kill the backend and just developed a polished frontend for the demo. 

After many sleepless and progressively delirious hours, we finished the frontend and demoed our product on stage. It was an outstanding success. Our project was written about in Techcrunch, went somewhat viral on Twitter, and included in a random Russian's educational technology presentation. 
Going into the Summer Program, the team spent a week in boot camp where we were exposed to a business-oriented perspective to starting a startup. We met with our mentor on a regular basis, and the program shaped the way we initially executed. We took the initial frontend, merged it with a few sketch files, and transformed it into a video demo/trailer for our product. My friend with a teaching background presented it at a UPenn Graduate School of Education networking event to get feedback from potential future users. People were thrilled with the demo, offering to pay us on the spot for a subscription. Turns out this customer-centric approach to developing a tech startup works really well. 

I ended up leaving Epigrammar in September due to cofounder issues, and started another startup called Prism (simpleprism.com) with another friend. Long story short, we didn't touch a line of code other than the landing page, and instead spent a significant amount of time polishing our business plan and idea, and applied to several accelerators. We ended up interviewing with Y Combinator, but since we were to nascent in development, and due to a weak in-person interview, we didn't get in. 

Through these experiences I've gained a significant appreciation for the business component to developing a tech startup. You can't just build a product, there's a lot more crucial nontechnical work that occurs behind the scenes. I hope this understanding will positively shape my ventures in the future.
"
"I had a group project for PLT and one person was not contributing throughout the entire project and I and the other members of my team ended up doing significantly more work to compensate. I now realize the importance of open communication, because although they did no work, I was partially at fault for not talking with them sooner about the issue. If I had spoken up sooner about the issue, the work may have been more fairly divided."
"Before coming to Columbia, I had background in both biomedical data analysis and social sciences (minor in college) and because I interacted with two completely different group of people (at a liberal arts college), at one point I mistakenly thought that these two fields were completely separate.  After starting the biomedical informatics program at Columbia, I learned that methods in social sciences are often borrowed in human computer interaction and they can contribute significantly to biomedical informatics by incoporating the human factors necessary for building successful informatics tools that supports biomedicine.  This process came about as informaticians and human factors scientists interacted and collaborated.   I learned that as I expand my social interactions circles, my worldview is expanded to include more ideas and possibilities.  Additionally, I learned that interaction and collaboration between people in seemingly unrelated fields can foster borrowing and combining methods in different fields and lead to new areas of interdisciplinary research.  "
"I once ran up to hug someone from behind who I thought was my mother, only to realize that she was totally not my mother; I caught an elbow to the nose and learned to ""look before you leap."""
"In a group project last semester, I thought there was only one way of going about solving a problem. I was hellbent on using my method. The other group members disagreed. I was very angry, but put all my effort into attempting to solve it their way. It ended up working. There are many ways to skin a cat and everyone is very smart. I should never close of or cut off someones opinion-- rather I should be open to whatever they have to say, whether I think it's right or wrong. I should always question preconceived judgements I make."
"I thought it was improbably that one could do production level machine learning by using only a few thousand hand labeled training data, but it turns out you can and facebook does that."
"I tutor high school students usually 14+ hours a week (plus about 1.5 hours in total travel there and back for each 2 hr session).  Last semester I took on too much and agreed to tutor too many people, and quickly realized I was not able to do this..However since I felt bad for making a commitment I stayed in this position for almost two months while doing all of my difficult coursework and I quickly realized that I needed to change something.  So, I had a friend at Columbia take my position for two of the students, which was a pretty good solution.  I learned that while I still should always push myself, I should not make commitments that drain me and leave me without sleep because I end up not being present in all of the things I do, and it is unhealthy."
"A friend recently became unreasonably upset, and the reason for her being upset also made me upset, which caused me to respond with anger. Never do this. If your friend, coworker, or anyone is angry and makes you upset, replying angrily will often make things go worse. I learned to first calm down, think, and then try to calm the other person down to diffuse the situation."
"Recently I was working with a team on project using IBM Watson's tone analyzer to detect undertones of mental illness in social media-- more specifically we began with tweets. Though the majority of our assignment would be in Javascript, I know Python significantly better, so I pulled tweets from the given usernames using Python. However, when it came time to link this with our frontend, we realized that the quick, hack-y way I had tried to use to connect Python and Javascript was impossible for the on-click operation. So, I rewrote the program in Javascript with a bit of help from an experienced programmer. I recognized that he knew far more than I did about this new language, and was able to work through the program with him as I thought of ways to rewrite the program, and he assisted me with built-in functions and syntax. I learned that I should look a bit farther ahead before attempting something that initially seems easier because in the end, the new Javascript file I had written combined the two previous programs I had tried connecting, with far fewer lines of code. I enjoy learning from every experience--whether I'm right or wrong-- but I believe the key to learning something new is recognizing when you need help, and I'm practicing that a bit more each day. "
