"I once set my alarm time for PM instead of AM, and ever since that day my phones time is in military time so that does not happen again."
"Out of the many, many classic mistakes that a young Columbia student makes, one of the first I ever made was on the first night of orientation. I grew up in New York and have always felt really lofty about my knowledge of the infamous subway system, in terms of train times, routes, service changes, and sleeping on another passenger without them knowing. But that all changed that night. A bunch of freshmen on my floor had gone downtown to explore, and on the way back up around 11:30 pm, I corralled the group to take the 3 express train instead of the 1 straight up to Columbia. My roommate indicated a very faded service change poster but I waved my hand and we boarded. In the midst of us talking, we didn’t realize that the train entirely missed Morningside Heights and went all the way to 148th, smack in the middle of Harlem. When the train conductor announced the end of the line, everybody broke out into a frenzy of fear—they had never been in Harlem, and had only heard terrible stereotypes about the area. I tried my best to tell them it would be fine and their preconceived notions were misplaced, but I realized that it’s tough to convince somebody to not be afraid of something they don’t know enough about. The best way to eliminate fear and reduce prejudice is to show them why they’re wrong. So we walked all the way through Harlem, down to Morningside, and it was absolutely fine. We all took away different nuanced memories from that night, but I learned that I should always be cognizant of people’s inputs, because I just might be wrong—and it’s okay to admit that. "
"I have been wrong while working on some of my programming assignments before, specifically because of messy and unplanned coding on my part.  For example, on a programming project for COMS 4111, Intro to Databases, I declared a primary key incorrectly for a project and spent an hour failing to realize why my database queries were not coming out the way I wanted them to.  From these kind of experiences, I have learned the importance of having a clear plan in mind before approaching a problem and also executing it in an organized way.  "
"At a recent Hackathon, I was in charge of getting an API to work with our web page. Since I was new to front-end programming it took me a bit of time. I found the API on google and tried to make it work with our interface. My teammates (whom I had met that day) were relying on me to finish this part. The only time I’ve worked on teams were at hackathons. I was trying to solve my issue, while my lack of progress intensified my anxiety. I was a point I commonly face in CS where I’m so sure what I have is right, but obviously it isn’t if it’s not working. Eventually, with the help of a teammate we realized it was in the wrong place. It was embarrassing how long it took me to realize this, in addition to asking for help. It gave me better insight into efficient teamwork, and when I should admit that I need a second hand. After that, things moved slowly but surely and by the end we got our app to work.
"
"There was a time when my teammate and I had a task to design a system for a specific scenario. Because of some personal stuff, I don’t take too much serious about discussing what we plan to do and how we collaborate to finish it. Later on, we found that we did the same thing which it’s not efficient enough for the whole period of app development. So after that, I always try to first communicate with my team members and know what to do in the next step. It turns out that it’s worthwhile and somehow necessary to do."
"During sophomore year, I declared my major as IEOR as I assumed I would love to work at the intersection of finance and technology. However, after taking a few courses in the department and interning at a consulting firm over the summer, I have realized that I'm solely interested in Computer Science and not in finance. I learned that you should never be too invested in anything until you get to experience it first hand and there is no shame in following your heart."
"I was thinking that put all my time in doing one thing would help me to make a great progress. Finally, I notice that sometimes inspiration is needed and it usually comes from other parts of our life."
"Prior to being accepted into Columbia University, I attended a community college where I took their version of Advanced programming.  During the course of the class, we had a group project which was to design a travel reimbursement program, and I was in charge of the travel expenses and hotel meal reimbursements. At this time, I was pretty new to programming, and my group member pointed out that I was returning in a void statement, when my group member was supposed to use the returned value in his portion. I corrected the mistake and I never made the same mistake again."
"Frankly speaking, this may not be a big problem, but I really learnt a lot from that, and this mistake help me build good habits. 

This happened in my sophomore year, right before final exam. Back to that years, I did not realize the importance of file management and backup. My computer broke down in system update, and all my files were gone, including the final report I just wrote that afternoon. That was a nightmare for me to recover what I have spent a lot of time on. 

After that, I learnt two things: firstly, always keep a backup, no matter how small the modification is, because nobody wants to do a same thing for two times; secondly, delete all the trash in time. Never mess the useful documents with the trash. I so seldom organized my files that there is always limited storage on my disk, and this eventually led to the failure of that system update. After that mistake, the management of files is the last thing I do before I go to sleep every day."
"After I missed that deadline, I created a spreadsheet for all future projects that showed everyone a project snapshot and clearly indicated deadlines and where we’re at in the process at any given time. Since then, I’ve never missed a deadline."
"Freshman year, I thought I could do everything myself. In high school, I was used to working by myself and I thought the same habits could apply when I got to college. However, I quickly learned that not every concept will be clear to me at its first instance, and that's okay. Now, I'm not afraid to be fearless and ask for help and working together in study groups.  It's okay not to know everything by yourself. There are many resources that I can turn to and over my semesters here I have had the privilege to use them."
"In my early days during my professional experience as a software developer for Goldman Sachs, I missed a deliverable deadline and failed to communicate this to my managers in time. I still had to compensate for this by working extra hours. Since then I have always ensured that I complete my work on time, and if not, ensured that I communicate my difficulties to my immediate supervisors so that they are not caught off-guard."
"During a project for a class I took as an undergraduate, I was sure that since I had more experience with C I had the right implementation of Depth-First Search in the kernel. The code kept breaking, and I didn't ask my teammates for suggestions as I was sure they would not be able to help. Finally one of them offered the correct solution, and from this I learned to ask for help earlier when struggling and not assume that others would not know better than I would"
"I was always reluctant to ask doubts/queries because I felt that it would make me look stupid and that people will judge me. But, while working on my Google Summer of Code project last summer, I had to post queries on mailing lists of the project that I was working on and to my surprise, people were very helpful and humbly answered all the queries that I posted."
"I got bad score in midterm. And I found that I need to do better in my time management, and when finding any problems, I should consult others for solutions in order to cut down the time I spent on thinking the problem by myself."
"During my undergrad, I had this mindset that its not possible to have a decent social life along with maintaining academic excellence. I chose to focus completely on courses. But I've met people who did both by prioritizing things efficiently and as a result have a lot more life outside classes, proving that it is indeed possible to do both. I regret my decision. I now see back and wish if I could have been involved more in public interaction and thus built a better network. I am trying that during my graduate time here."
"When I decided to pursue my interest in design, I immediately thought “graphic design” and completed a summer course at Parsons School of Design. Having already studied painting and drawing at a high level at RISD and at Columbia, I assumed I would enjoy graphic design as a first step into the design world. However, I was completely wrong and didn’t enjoy designing logos or typography. I realized that I was more interested in understanding the “client” and how to translate his/her intentions visually. Given my psychology background and my specific interest in judgment and decision-making, I am particularly interested in how people interact with design and how different design influences perception and behavior. Thus, although I was wrong about predicting I would enjoy graphic design, it led to me figuring what kind of design I do want to pursue, so I do not regret taking the course at all! "
"One time, I was writing a migration for a particular issue I was assigned. It had to deal with legacy code. Although I initially thought the migration didn't affect other parts of our application, after it was merged, the current product we were working on could not load because I did not edit our newer database. Something important that I took away from this experience was that I should not make any assumptions that everything works the way it does right when I finish writing my code --- I should extensively check for edge cases and look at the different parts of an application/at the whole picture. Even though my migration did what it was supposed to do, I didn't pay attention to a one line change that affected other people's work. Communication and a greater attention to detail were two key concepts I learned from this. "

"Speaking purely on the subject of design, I was very incorrect when designing an app for film reviews. I gave the app to a professor for review and she ripped the design apart. She took apart almost everything about it, citing the discoverablity of features as one of the main design flaws. I quickly realized that I had made the app for myself, not for a user with no prior knowledge of how it worked. It was especially hard to swallow since before turning it in I was under the impression that the design was beautiful, simple, and easy to use. The experience made me realize how important design principles are in tech and how much I have to learn about them."
"For one of my coding interviews, I practiced for a few days and looked over the complicated questions that I might face. I was confident enough in my coding abilities that I didn't feel it necessary to go over the basics and trivial methods. Turned out, I was able to come up with the pseudo-code but not the full implementation. From then, I always devote way more time to brush up the basics and start early to have a better preparation."
I was recently  wrong in assuming that a Christian friend would be very judgemental and not accepting of my sexuality. But I was wrong and she was accepting. I learned not to assume things about others without actually experiencing concrete information or responses . And that even if someone has a negative response they may be open to a conversation about how that impacts you. I think this is very important in Trump’s America .
"I am most frequently wrong in relatively benign situations that depict gaps in common knowledge. For example, until eighth grade, I was under the impression that the Hudson river flowed through Massachusetts. I thought this because in sixth grade I went on a duck tour in Massachusetts and I thought the tour guide said we were in the Hudson River. From this I learned that I should double check sources and not always take things at face value."
"Last year, I was working on a project called Duet at an accelerator at MIT's Sloan School of business with my teammates. Everything over the summer was going perfectly and we were on track to launch our product in early January. We piloted our MVP and customer feedback on our project was excellent. 

I was excited for what was ahead but lacked the foresight to see how things would end up. We all lived in different areas, so once we went back home our project starting fall apart. Our lead engineer, who was still in high school, felt that the startup was unlikely to succeed given we were all far apart and decided his college applications were his priorities. Another co-founder made promises to help us to continue building partnerships, but the distance proved to be difficult for accountability issues. I tried to keep things in track and figure out how to reengage my co-founders, but ultimately failed at this.

One of the biggest things I learned is it's crucial to understand early in what makes every person tick. After this incident, whenever I work on a team project I try to understand each person’s underlying motivations and goals. 
"
Don't take 7 courses in the same semester
"I went to my first hackathon during my freshman year of high school and was convinced that the project idea that one of my teammates had would be too difficult, too unnecessary, and not worth our time. I was outvoted by the other members of my team and we ended up creating a really cool product which I still talk about to this day. After this experience, I've become more openminded and ambitious with the projects I attempt. "
"At my internship last summer, I was asked to pull records from a database and run an analysis. I was assigned it on short notice, and asked to complete it as a higher priority than the  rest of my work. In a rush, I made an assumption about the data that majorly skewed the results, and then proceeded to deliver the skewed results to my boss's boss. Both were frustrated with me. Though one takeaway was certainly that I ought to pay more attention to detail when in a rush, I also learned about how I respond to negative feedback. I have a tendency to shy away from confrontation and take any blame, rather than explain the thought processes that led my to my mistakes. I learned both about noticing when I'm rushing/missing details, as well as the value of being self aware when receiving feedback,  and then trying to convey what led to issues whilst taking ownership for what I did wrong. "
"My most recent memories of being wrong about something have always been when I don't listen to my gut. During my junior year I secured at internship at Etsy that was supposed to begin in June 2017. About a month before the internship was supposed to begin, I started hearing news about management changes and employee layoffs. Yet, I thought to myself ""oh, nothing will happen to me"". I think it was definitely my mistake to not be more aware of how companies work and  not be aware of current events and how they will affect me. Yes all the interns, including me, were actually fired 2 weeks before our start dates. While I was somehow able to land another internship, I think I'm much more mindful and vigilant about what's happening in the tech industry. Within the scope of my education here at Columbia, I've enjoyed the protection I've had as a member within this institution and as I prepare to join the working world, I've realize I need to be more perceptive of my opportunities and my life decisions. "
"At my last internship, I was tasked with increasing campaign efficiency by 8%, but fell short of that goal. I tended to just dive into rushing towards a goal, without make a concrete, organized plan first consisting of small steps to reach that goal. I learned that if I had communicated my roadblocks more quickly to my superiors, I would have reached my goal sooner. "
"Last week I went to the New York Passport Agency downtown to pick up my passport on Friday, November 10. When I arrived, I saw that the agency was closed because it was Veterans day. I then realized that I wasted a trip downtown and two hours of my time. I learned from this that I should always check if where I want to go is open before going there, to not risk the trip being a waste for whatever reason. Essentially, I learned that I need to plan better."
"I used to call library when programming without understanding the principle of it. Last time in Prof. Stein's Analysis of Algorithms mid-term, there was a sort algorithm problem which requires us to solve in O(n) time. I didn't think twice, and just use hash table, which turned out to be wrong, as Prof. Stein explained it later. We shouldn't use any algorithm without getting fully understanding towards it or implement it by ourselves. That it a lesson I learnt from it. "
"Visiting home again for my birthday, my girlfriend and I made the rounds of people I knew to say hello. She had had a negative impression of one friend of mine, of whom I had a very close friendship during high school. Although I knew he could be abrasive, I held a high opinion of him. Meeting back up with him was embarrassing; the people he has fallen in with have had a negative effect on his judgement and his health. Although I can't say this without reminiscing on my own shortcomings in similar regards, it was a plunge in esteem that I had not expected. People change, and those around you affect who you become, the tendencies you acquire, and the standards you hold. I have to surround myself with people who I believe to push me, people who hold me to a standard I struggle to meet, but who inspire me to attain that level of quality in my own person. "
"I spent a while trying to use a Java framework the wrong way over the summer due to a version mismatch. I had written a mountain of hacky solutions to deal with it, but I was still convinced there was a better way to do it. There was, and when I redid all my work I made sure to read the documentation for everything. It turned out well, and I realized it was actually a pretty elegant framework. "
"I taught myself web development through hackathons and side projects. In the process I developed a unique way of programming that in many ways proved to be detrimental to the projects I was building. I had a strong dislike of development frameworks, preferring instead to build out self-developed APIs from scratch using pure HTML and Javascript (and some jQuery). 

At PennApps in my sophomore year, one of my teammates finally sat me down and told me that I was programming the dumb way. He pointed out that I was reinventing the wheel, and introduced me to powerful libraries like Angular, Express, and Socket.IO. In addition, he encouraged me to look into front end best practices and to rethink how I program in JS. Once I realized how much time I was saving, I picked up his advice and dropped my preconceived notions about how to program. "
"I am the president of the Columbia Photography Association. Recently, my board and I decided to host a ""photo critique"" workshop. After following through, we soon realized that the title ""photo critique"" was too intimidating and inhibitory for beginner and intermediate photographers, thus resulting in low turnout. Through this experience, I learned that empathy and ""imagining yourself in someone else's shoes"" are crucial skills for any kind of project aimed at a specific target audience."
"When working on a sensor project, I thought that because our data wasn't a perfect proxy for what we were trying learn and we sometimes had holes in our data due to cellular connectivity issues, we would not be able to use it. But it turns out that you can take something imperfect and still find ways in which it is valid and useful without ignoring or hiding it's problems."
"I have currently been working as a software engineer at Financial Partners Capital Management, building the back-end of a certain service that would communicate with the server we were pulling our data from. My direct supervisor who was a finance guy,  was telling me  to do certain aspects of the project in ways that I didn't think made sense from a programing point of view. However I was wrong and I learned a true lesson on academic modesty and the dangers of thinking inside the box. "
"During one of my internships as a software engineer, the server cluster in my team suffered from a small-scale break-down due to my false understanding of the infrastructure that we used, which led to a small but fatal programming mistake. What I learned from this is that whenever you are learning something new, always make sure that you really understand it instead of having a shallow idea and starting to feel good about yourself."
"I have made tons of mistakes. I don't know which kind of mistakes this question wants to ask for. In my opinion, the biggest mistake I made is selecting wrong major in undergraduate school, which suffered me for 4 years. Fortunately, I made a correct choice while applying for graduate degree. This experience teaches me to select major I really interested in."
"When I was building an app 'Overcast' with a friend to help users encrypt their facebook messages , we spend a great deal of time on the design and UI of the app. Because we were essentially building off of an existing website, we did not have that much freedom, but I still took every chance I got to add in a new feature when I could. My partner tried to convince me that the app was getting too cluttered, but I was sure that the features were worth it. In the end, when running it by another person, they immediately said they had no idea what was going on because the thing was so cluttered, and I quickly learnt that having an extremely capable product is essentially useless if the user does not have intuitive access to those very functions! It was an important lesson to be sure, and I look forward to learning more like it in this class."
"In my position as a data analyst, I once gave a presentation on slides I had not prepared myself. Because I had not prepared the slides myself, I wasn't able to effectively answer any in depth questions. I simply stated that I didn't know because I did not create the slides. I was wrong to not research the information beforehand and this error proved a valuable lesson. Now, anytime I reference, produce, or present anything, I take full ownership of the subject. Regardless of where the information comes from, if I am using it, I must understand it at its source."
"Several years ago, one of my roommate has an iPad and he was pleased to lent it to me. However, one day he was not at the dormitory, but I still used his iPad without his permission. After that, he felt quite angry because he thought I should have tell him. From then on, if I would like to borrow something from someone, I know that I have to inform that person. If he is unavailable, I should wait for his response because it's his property."
"First semester of college, I was dead-set on studying computer science while fulfilling the premed track.  My rationale for doing so at the time was that I had done mostly biology and chem related extracurriculars up to that point, while I'd never done any work in computer science before I took 1004.  It felt safer (I told myself) to be able to ""fall back"" on the premed track but leave my options open by studying CS. Thankfully I made the decision to drop premed-- from this experience I learned that commitment is the first step to success-- by leaving too many options open, I was ultimately shooting myself in the foot by initially doing not-so-well in both areas since they are so disparate."
"I worked on a project to output sets of potential grades a student can get in order to attain a desired GPA. I was excited and overly ambitious initially, wanting to consider the best case first and looked only at the end product. A teammate reasoned that we should consider a smaller subset first and work our way up instead of complicating our progress with a complicated big picture. I learned to slow down my thinking and consider different approaches before starting a project, and realized the influential power of teammates."
"I work at BCIT and found out a few weeks ago that I'd been giving students an incorrect answer for a rather commonly asked question. I learned that even though I am one of the more experienced students employed there, my assumptions and instincts can't always be trusted, so asking for help from a coworker or supervisor is often a good precaution."
