"During my last summer internship, I was working on integrating Google Publisher Tag advertisement slots into the Singapore Michelin Guide website, which was built on Grails. I started by simply changing the existing hardcoded static ad tags to GPT ads. This worked at first because I only worked on the front page. However, my supervisor later wanted me to incorporate about 70 other advertisements throughout the website, including in the article template, which generated article webpages dynamically based on content. When I tried to simply hardcode the ad tags in, I ran into two issues: the ads would often display too close to each other or to the top/bottom of the page, and it was tedious to add that many advertisements to the website by copying and pasting the same tag. 

I realized that I had made a mistake by trying to integrate the ads in this way, and instead made a new Grails tagset for the GPT ads and added code to make sure the ads were appropriately placed in the middle of the article and spaced apart. I learned that I should have started with this more scalable fix, anticipating that I'd have to add so many other ad slots, instead of just copying and pasting some code at the beginning. "
"I was working on this group homework on Machine Learning. My teammate and I took different approaches on a problem and we got different answers. After we went through both versions, I found out that the other approach was actually correct. I learned that sometimes we can benefit from different views and learn from them."
"This past summer, I began thinking about Junior-year internships. I thought that with my military experience, financial-industry experience, and most recent programming internship at a startup, I'd have no problem doing well in interviews and securing any internship I wanted. I couldn't have been more wrong. At first, after applying to my top choices, none of them contacted me back even for a first interview. Then, once another company did finally contact me, I was shocked at how slow and inefficient I was at solving their coding question. This was a huge disappointment, and definitely humbled me a bit, realizing that the talent and competition for software engineering around me is huge.
However, I was up for the challenge- I dove right into studying and improving my application. I practiced coding problems every day, reached out to my peers for advice and referrals, and started working on a side project to boost my experience. The first few interviews were still rocky, but I was learning a lot- and finally when I was able to reach through to Facebook for a first round (my top choice!), I felt as ready as I could be and did well in the interviews!
Long story short: I didn't realize how behind I was with tech experience and wasn't aware of the amazing talent around me, but took up the challenge and utilized the resources at my disposal to improve and learn."
"I'm pretty stubborn by nature, so I like to do things my way, from taking the directions I know to coding using certain practices. One time I was working with a friend on a programming assignment and found myself having difficulty figuring out how to implement a function recursively. Instead of asking for help, I kept trying to debug and debug, and this stubbornness would leave me sleepless the entire night. Eventually I did ask for help from my friend, and he showed me that I was making a small error that was preventing the function from running as I intended. I learned that it's important to swallow your pride and ask for help, even when you don't want to, because it can go a long way and make what could be a difficult task much easier than expected in the end."
Freshman year I was on my way to an interview and I missed it because I was late to it by 30 minutes because I got lost in Chinatown. I thought that it would be easy to navigate and I would be able to make it in the time that google maps gave. I learned to always give myself more time to travel to new places to account for delays in transportation and getting lost. 
"This semester I was doing research at Creative Machine lab, building an app taking livestream data from ultrasound scanning probe and display 3D shape of the scanned object on mobile and native app. My initial thought was to use Javascript, since it is convenient to convert JS into both native app (using Electron) and mobile app (creating an app that redirects to a website built in JS). However, I underestimate the requirement at computation power, since there are more than 1M data points we need to process at each second, JS is not able to support such large amount of data computation at a high enough speed. We later turned to CPP and build our app on QT. What I learned from this experience is that whenever developing an application based on certain requirements, always think through from different perspectives on what can be some potential bottlenecks on the performance of an app. Only after we figure out the performance that we need to achieve, we can think about something extra that will make our product better."
"A few years ago I discovered I had given incorrect information about server configuration settings for a client which inadvertently had resulted in performance slowdown. Before my discovery, it was my belief that my configuration was correct largely due to my experience in computers and server setup. Being the stubborn individual that I was, my assumptions were incorrect that the client was solely responsible in causing the server to slow down. It was not until I had looked over my own notes and the operating system's documentation that the client received outdated information that no longer applied to the new system. As you could imagine, this predicament was highly embarrassing as I prided myself in knowing and keeping up to date to changes in the software I utilize. In hindsight, after thinking over the experience I recognized the faults at making false assumptions of my own abilities and assuming blame on the client (the primary user in this case). Based on the outcome of this case, I learned the importance of consistently questioning one's self over choice of design for a client's use and whether all information over a particular system is being correctly applied for optimal performance."
"On my research team, my partner and I were arguing about hardware design for a liquid extrusion system. We ended up 3D printing our respective designs and putting them to the test, and his clearly won. Afterwards, we sat down and he explained some great design principles – besides considering fluid dynamics of the liquid extrusion, there were also basic things to think about, like setup and cleanup of the design. "
"Just a few minutes ago, I was wrong about being able to take a Psychology class and had a cathartic experience. To register for any Psychology seminar, one has to first send the seminar professor an email detailing about oneself, one's experience, one's major requirements, and one's reasons for wanting to take part in the seminar. I thought the seminar class I was registering for was an exception and I wouldn't have to send an email to the professor. However, it turns out that I had to. Therefore, I sent a long and detailed email to the professor. The professor replied within 10 minutes saying that I would not be able to take the seminar either this year or the next (or any years after that), because the seminar was filled with Neuroscience and Psychology majors, while I am a Computer Science major with a Psychology minor.

I had already planned out my course schedule and was really pumped to take that seminar. After reading that heartbreaking email, I gained first-hand experience in rejection, in-group preference, and marginalization. I learned about myself: how I was too sure about my own plans, how I had to become more adaptable. I learned about having more back-up plans and to understand the professor's perspectives, and to take into account that there are so many people in the world who want so many things that are so similar to things that I want. More practically, I gained experience in emailing professors emails courteously. After the experience, I have begun to explore more options, considered other courses and ways to spend my time here at Columbia, and started to appreciate and make do with what I have."
"This past summer, I interned at an aerospace company and built a customized tool to measure material properties. At first, my software accompanying the tool ran as a command-line program. I thought the senior engineers would be impressed with my tool's accuracy and measurement speed - but as they squinted at the tiny numbers in my terminal window, and asked how I was sure of my results, I realized they weren't. I learned that user interfaces, and presentation in general, isn't just a concern for large-scale, polished tech companies. They are necessary to interact with and generate trust in smaller projects as well. I spent the rest of the summer learning Qt and attempting to build a UI that better communicated what my tool was capable of. "
"I didn't know what a VM was during my first session of ADI labs, and made the mistake of trying to describe it when speaking to the team leader. I was embarrassed, but his encouragement afterwards taught me not to be ashamed to ask questions when I didn't know something."
"I spent an entire summer at a soul-crushing job at Amazon working in Finance because I thought it would be worth the money even though I'm not interested in Finance at all (also thought I could get a foot in the door with the software engineering departments there)

I learned the importance of taking your own happiness in consideration before making long-term decisions that might benefit you in the future"
"I have found that I am wrong about lots of things during this year. Firstly, I am not as smart as I thought when I got the offer from Columbia and secondly, due to previous misunderstanding, I am not working hard enough for my first semester. When I got the offer, I was so happy that I forgot I am not a native speaker in English and my knowledge of software is limited as well. These are the reasons why I feel study is so difficult now. At the beginning, I choose to be focus on taking notes instead of really understand what professor taught and never review the notes after class. After three months of adjustment, I am trying to conclude a better way by myself. I still take notes during class but only abstract conclusion and I write more questions than answers. I would look into these questions after class and make a list of knowledge I find difficult. I use Google and Piazza more often then before, and study not just from professor and TA but also my classmates as well. Even though it takes more time and effort, I find it quiet useful for me and I would like to keep this habit in following study."
"I work at an English-as-a-second language program for immigrants. One time I was asked to sub for a teacher: I expected the students to find grammar topics drab so I focused on vocabulary topics despite what the lesson plan had scheduled for the day. However, when I actually taught the lesson I found the students to be very interested in grammar, preferring its clear, almost algorithmic rules to the more general and mnemonic vocabulary exercises. From this experience, I learned that while gut-feeling is important, it's also important to pay attention to what people with more experience and knowledge may advice."
"Though the details are much less relevant than the lesson I learned, I will include some context: as a teaching assistant for Data Structures, I encounter many interesting uses of Java throughout the semester, and tend to assume that anything I don't recognize immediately is probably wrong. A student whose midterm I was grading used the bitwise XOR operation on two booleans, and I deducted points for invalid Java. As I was working on a separate assignment later that day, I realized that this is of course not true, so I sorted through 250 midterms to find the one I made the mistake on and gave the points back. From this, I learned to be less cynical to new approaches to problems that I had not previously considered and to extend the benefit of the doubt when I am unsure about something."
"First, in study, when I pursuing my master degree in another field, I was doing research rather the homework. I always thought that what I should do is a big, totally new thing. However my tutor always asked me to do the thing that someone else has done before.  After several years, I understand that we can not always make a big break, sometimes a small change or a small innovation also needs lots of effort. So what I learn is to pay attention to the details, they are not easy.
Second, in life,  I always think I am still young to maintain a good health and the goal of my life is to study. As time going, I understand that I can not ignore the health. Good sleep, eating well, regular exercise are things which will give me a better condition to learn more things."
"I remember a time when I have different opinions with my group members on the   Matlab project and I am wrong with some details. I decided to have more discussion and meetings with them to solve the problem together. After this, I learned that when I were wrong sometime, I should be patient to think and solve the problem with group members together with more discussions and meetings."
"My mistake is about choosing the college. When I applied for school, I got accepted on both a small college in PA and a university in NYC. My parents and a lot of my friends recommend me to go to the Fordham, cause it is in new york. However, I thought I would love a smaller liberal arts college, so I decided to go to gettysburg. It was a nice experience, but after study there for a while, I feel that my life is too peace and quiet. The life there isn't very challenge and due to the location, there aren't many opportunities open to students. I enjoy studying there but don't really want to live a life like a retired man. So I decided to take the combined program in my school and study in columbia university. After this experience, I realize that people's advice, especially people older than me, does really helpful. Also, I discover that I am the person who likes challenge and fast pace life better. "
"I once thought that UI design is purely an artistic thing. My perception was that a good software should just have best technology implemented. I did not pay much attention to the UI aspect until the time I was to build up a software prototype in my software engineering class. During the demonstration, I noticed that compared with other works, my software interface turned out to be raw and hard to manipulate. So even our functionalities were the same, people favored those user-friendly interfaces. It was then did I realize that the ultimate user's feeling also matters, even more than the technology itself. So in my further projects, I have paid more attention to making our software user-friendly and easy to recognize, which has also led to my growing interest in the UI field."
"I have been wrong about unbelievably so many things, and I am the better for it. For example, I didn't have a shred of intellectual humility before I took freshman intensive organic chemistry. I didn't care to know how much of an icon Prof. Ronald Breslow was in the field or how bright and fascinating my classmates were. I placed into the class on a bet, and all I wanted to do was to prove that I could do it. My doggedness was more misplaced pride than tenacity: It's not that I was wrong in thinking I could take and pass the class. (I did, barely.) I was wrong in thinking I could lone wolf the class and get by without re-examining my study habits and academic discipline (or lack thereof). 

I learned a lot about my limitations from going through that class, and I learned the value of a solid support network (everyone needs that one friend who will tell you your first-ever failed midterm isn't the end of the world) as well as generalizable techniques in approaching material I have zero familiarity with and persisting until I understood, as Feynman would define genuine understanding. I learned that beyond the grade, the class presented me with other self-selecting students who could be really cool to get to know, as well as a professor full of wisdom who will be dearly missed. 

More than anything else, I learned how the hard thing about hard things is putting forward the intellectual honesty and courage to stay with the hard stuff, how to not take my learning for granted, and that if all else fails, ""And then a miracle happens"" is the kind of absurd hand-waving that just might net a few pity points on an exam. (I am joking about that last part: You will never see that kind of half-assed answer from me in class.)"
"Last year, in data structures, my friend told me that sitting in the front row would improve my concentration, my note-taking, and my participation with the professor. I am normally a student who likes to sit in the back, so I didn’t believe him. He convinced me to try, however, and he ended up being completely correct. I received the best grade I have ever gotten in a CS class thanks to careful, attentive, engaged note taking every single class, which I credit largely to sitting in the front row. I learned my lesson about lecture habits, and still sit as close to the front as I can today. "
"Having been married to someone smarter than me for a long time, I have learned that there is a point in every argument when it's time to stop talking and start listening because it is very likely that I am wrong and need to re-evaluate the basis of my argument. If after that process I still think I am right, I have learned that it is more productive to compromise than try to win an argument."
"Last week, I was wrong in judging the character of a friend before getting to know him better as a person. I assumed that he carried his behavior in a certain way because he was mean-spirited. However, after speaking to him, I realized that there was a lot going on in his life that I didn't know, and had I known, my words to him would've been less harsh. Through it, I learned that it's really important to get to know people well, how they think and why they interact with the world around them a certain way, before I make action/design choices. "
"I built a website to help my friend ask his crush on a date last summer. Since it was my first time building a website, I made many trial and errors. During the process, my biggest mistake was to not backing up my code and accidentally deleting part of the code that created the pop-up message box. It took me several hours to find the missing code. From this, I learned to always backup and track my code changes even if it is a small personal project."
"This semester, one of my computer science courses involved a very difficult project. After weeks of non-stop work on the project and many late nights, I finally got the optimal solution, which only a handful of people figured out. Unfortunately, my earlier draft was saved under the same name on my computer and I accidently submitted that one instead. Although I was positive that I had made sure the correct one was submitted, it became apparent after the assignment was graded that the project was an earlier iteration. I lost a large portion of the points and my overall grade noticeably dropped. Although this was a painful experience, it taught me about the importance of attention to detail, double-checking work, coming to terms with mistakes, and resilience."
"I am currently doing a database project, and made a lot of mistake, but learned a lot from it. "
"When I was working with a high school friend of mine during the summer after my freshman year to make an app (""DoorSlice,"" now closed) (he was coding front end and I back end) I was also taking summer classes. My friend and partner in this endeavor, Oliver, knew I had registered for classes before we embarked on this project together, but I was wrong to think it was thus an issue I did not need to hash out. Halfway through the summer this unspoken frustration of a difference in work on the project (because I was going to classes two hours a day while he remained working in the apartment) came to the surface and led to a fairly big disagreement between us two about who was working harder, front end vs back end responsibilities, etc. 

I learned that one can never ""over communicate"" with their team. Although I thought we we're on the same page regarding me taking these summer classes while we worked on the project, clearly we we're not, and it's better to risk having your teammate tell you ""yes I get it!"" in an annoyed manner because you're over communicating than to risk leave something uncommunicated."
"I worked at CNN last summer, where I spent a large portion of my job dressing articles for the online site – that meant embedding links, photographs, galleries, videos, and related articles for several pieces a day. (This furthered my great interest in user interface design, even on a site that's not terribly technically advanced at all. I was constantly concerned about the user experience.) On an article about the Great Barrier Reef, I had accidentally linked one segment to an article about Cardinal George Pell's sexual abuse – it sounds like a trite or mechanical thing to be wrong about, but it's actually a grievous mistakes, especially when the article was posted to Facebook, and many readers (esp. anti-CNN ones) opened it and realized the mistake. I realized quickly, in my first weeks there, that there are actions beyond just moral issues that implicated those around you...especially when it comes to the user experience online, on a site that millions of people read. I was so careful and cognizant going forward. This incident makes me think of not only the intended user experience, but also the one that occurs as a result of non-intentions. "
"To speak to this prompt, I would like to share an experience during my tenure as the Interfraternity Council Vice President of Finance. As the governing board that oversees all 11 fraternities at Columbia, we have worked very hard to try to make the community better. One of our initiatives is to fund and install noise insulating curtains for all the greek brownstones to reduce the number of noise complaints.

However, due to the complex organizational structure at Columbia, it took me several months communicating with FSL (Fraternity and Sorority Life) and made no tangible progress. With the deadline of our funding application approaching, I decided to reach out to housing directly in desperate attempt to get a quota on the project.

This decision to bypass FSL led to several conversations with the advisor, who explained how the complex structure is designed to protect all parties involved and overstepping one might lead to severe consequences.

In retrospect, I think given the structure that is in place, there is little room for time efficiency improvements. But I believe I could have done better in the future by seeking more alternative options in the event of a timeline issue with the main option."
"Last year while working on an Artificial Intelligence project, my teammate and I came to a crossroads. We were in debate as to the best way to solve one of our project's problems. After a great deal of debate we went with my solution which after many hours of work I realized that my solution was wrong. We had to redo a lot of the work and it lead to a multitude of hours being spent on an incorrect implementation. This helped me understand the importance of working through a problem on paper with a team member before implementing it. It was not a waste of time but a learning experience for me and I hope I can continue to use this newfound understanding in future projects."
"I am currently taking COMS 4160  (Computer Graphics), and on a recent assignment I had an incorrect understanding of a concept. What I thought was the proper way of going about shading calculations was actually wrong, and I ended up with incorrect output. However, upon looking at the homework solution afterwards I fully understood the concept and was able to implement shading calculations correctly and without any issues on later assignments. "
"This is not a single moment, but a common reoccurrence in my life...  I tend to be prone to losing things. My phone, my wallet, my keys, you name it I've probably lost it at some point. To combat this I've made it a habit to label EVERYTHING with my name and phone number  (My DYMO might be my most prized possession), I've purchased a number of tracking devices and keychains (Tiles, Trackrs, Apple Watch that help me to quickly locate my keys and wallet). I've also become very familiar with find my iPhone. I've trained my brain to always look back when stepping out of a train or car and I've overall become more organized make sure everything is in it's right place.  Thankfully over the last few years I've had no major losses due to these precautions, I can also thank the kindness of strangers who've actually returned things to me... restores my faith in humanity every time."
"I am currently taking ASE and is working on an actual project for the first time, and we are using git as the version control system. I have been avoiding to learn thoroughly about VCS because I feel like it is somewhat weary and not worth it - till I accidentally pushed uncompiled code to code freeze branch before project demo. Luckily we solved it but the price was a whole nighter. It (finally) made me realize the importance of VCS and it's key role in software development process - you can't always keep track of everything in mind, especially working in a team environment."
